{"artifact_class":"exp002-auto-approval-dossier","claim_ids":[],"exact_models":[{"model_id":"EleutherAI/pythia-70m-deduped","revision":"e93a9faa9c77e5d09219f6c868bfc7a1bd65593c"},{"model_id":"HuggingFaceTB/SmolLM2-360M","revision":"f8027fd0eaeea54caa13c31d31b9fdc459c38b49"},{"model_id":"Qwen/Qwen3-0.6B-Base","revision":"da87bfb608c14b7cf20ba1ce41287e8de496c0cd"},{"model_id":"openai-community/gpt2","revision":"607a30d783dfa663caf39e06633721c8d4cfcd7e"},{"model_id":"HuggingFaceTB/SmolLM2-135M","revision":"93efa2f097d58c2a74874c7e644dbc9b0cee75a2"},{"model_id":"EleutherAI/gpt-neo-125m","revision":"21def0189f5705e2521767faed922f1f15e7d7db"},{"model_id":"Qwen/Qwen2.5-0.5B","revision":"060db6499f32faf8b98477b0a26969ef7d8b9987"}],"input_manifest_sha256":"92948c6cd7767d7945b2a0e5c88ab8c2152ba77fd4ba6c75e60896b82e2b4095","limits":{"new_score_output_bytes_per_model":134217728,"peak_rss_bytes_per_shard":8589934592,"wall_time_seconds_per_shard":1800},"operator_approval":{"approval_text_sha256":null,"granted":false,"operator_id":"MarcoPorcellato"},"permissions":{"generation":false,"model_load":true,"network":false,"sealed_target_read":"exactly_one_at_analysis_boundary"},"protocol_id":"exp002-auto-v1.0.0","protocol_sha256":"49c5db1150c0d7ebec71ed9601fbbdda2bdfd9d452ea60ad44639a6f10e747e7","schedule_sha256":"9fcd8efd63821bbc081b50c261d3a3b24c772ec5db717be5d2e1656b56def7dc","shards":[{"shard_id":"auto-0-tokenizer-audit","stage_id":"AUTO-0"},{"shard_id":"auto-1-cyclic-and-label-free","stage_id":"AUTO-1"},{"shard_id":"auto-2-factual-01","stage_id":"AUTO-2"},{"shard_id":"auto-2-factual-02","stage_id":"AUTO-2"},{"shard_id":"auto-2-factual-03","stage_id":"AUTO-2"},{"shard_id":"auto-2-factual-04","stage_id":"AUTO-2"},{"shard_id":"auto-3-canonical_short_field","stage_id":"AUTO-3"},{"shard_id":"auto-3-structured_paraphrase","stage_id":"AUTO-3"},{"shard_id":"auto-3-matched_non_triz_control","stage_id":"AUTO-3"},{"shard_id":"auto-3-nonce_edit_control","stage_id":"AUTO-3"},{"shard_id":"auto-4-agriculture","stage_id":"AUTO-4"},{"shard_id":"auto-4-energy","stage_id":"AUTO-4"},{"shard_id":"auto-4-logistics","stage_id":"AUTO-4"},{"shard_id":"auto-4-manufacturing","stage_id":"AUTO-4"},{"shard_id":"auto-4-medical","stage_id":"AUTO-4"},{"shard_id":"auto-4-software","stage_id":"AUTO-4"},{"shard_id":"auto-4-construction","stage_id":"AUTO-4"},{"shard_id":"auto-4-public_services","stage_id":"AUTO-4"},{"shard_id":"auto-5-permutations-01","stage_id":"AUTO-5"},{"shard_id":"auto-5-permutations-02","stage_id":"AUTO-5"},{"shard_id":"auto-5-permutations-03","stage_id":"AUTO-5"},{"shard_id":"auto-5-permutations-04","stage_id":"AUTO-5"},{"shard_id":"auto-5-permutations-05","stage_id":"AUTO-5"},{"shard_id":"auto-5-permutations-06","stage_id":"AUTO-5"}],"status":"approval_requested"}
